horsename,birthday,country,color,service,win,father,mother,motherfather,inbreed,cropwin,cropwinnative
エイシンニシパ,2013年,日本,黒鹿毛,2025年供用開始予定,ＭＲＯ金賞[金沢]，岐阜金賞[笠松]，新春賞[園田]（５回），名港盃[名古屋]，姫山菊花賞[園田]（２回），はがくれ大賞典[佐賀]（４回），兵庫大賞典[園田],*ワイルドラッシュ　（アイスカペイド系）,エーシンカリーナ　（2-c）,*アグネスデジタル　（ミスタープロスペクター系）,父系×母系５代前まで完全なアウトクロス父系内のみなし母系内のみなし,?,
ウィンターフェル,2016年,日本,青毛,2025年供用開始予定,?,ダノンバラード　（ディープインパクト系）,トピカ　（5-h）,*プリサイスエンド　（エンドスウィープ系）,父系×母系Angelic Song=Glorious Song 3×4，Halo 4*4×5，Mr. Prospector 5×5父系内のみなし母系内のみなし,?,
ミッキーマインド,2015年,日本,鹿毛,2025年供用開始予定,?,ディープインパクト　（ディープインパクト系）,*マイグッドネス　（9-f）,Storm Cat　（ストームキャット系）,父系×母系Northern Dancer 5×4父系内のみなし母系内のみなし,?,
*ワンチャンプ,2021年,アメリカ,栗毛,2025年供用開始予定,?,Curlin　（スマートストライク系）,Stage Magic　（1-h）,Ghostzapper　（デピュティミニスター系）,父系×母系Deputy Minister 3×4，Mr. Prospector 3×5父系内のみなし母系内のみなし,?,
ジャックドール,2018年,日本,栗毛,2025年供用開始予定,大阪杯[G1]，金鯱賞[G2]，札幌記念[G2],モーリス　（シルヴァーホーク系）,*ラヴァリーノ　（4-k）,Unbridled's Song　（アンブライドルズソング系）,父系×母系Northern Dancer 5×5父系内のみなし母系内のみMr. Prospector 5*4,?,
メトセラ,2019年,日本,黒鹿毛,2025年供用開始予定,?,キタサンブラック　（サンデーサイレンス系）,*ドナブリーニ　（16-f）,Bertolini　（ダンジグ系）,父系×母系Lyphard 5*5×4父系内のみなし母系内のみNorthern Dancer 4*5,?,
スカーフェイス,2016年,日本,鹿毛,2025年供用開始予定,?,ハーツクライ　（サンデーサイレンス系）,スプリングサンダー　（7）,*クロフネ　（デピュティミニスター系）,父系×母系Northern Dancer 5×5父系内のみなし母系内のみなし,?,
カレンシュトラウス,2017年,日本,鹿毛,2025年供用開始予定,?,ルーラーシップ　（キングカメハメハ系）,アグネスワルツ　（22-d）,ゼンノロブロイ　（サンデーサイレンス系）,父系×母系*ノーザンテースト 4×4，Mr. Prospector 4×5*5父系内のみなし母系内のみなし,?,
アドバイザー,2015年,日本,栗毛,2025年供用開始予定,?,*タイキシャトル　（デヴィルズバッグ系）,テイクザスカイ　（1-s）,ゴールドアリュール　（サンデーサイレンス系）,父系×母系Halo 3×4，Thatch=Special 4×5，Northern Dancer 5×5*5父系内のみなし母系内のみなし,?,
アイオライト,2017年,日本,黒鹿毛,2025年供用開始予定,?,ローレルゲレイロ　（ダンシングブレーヴ系）,ステラアクトレス　（7-e）,*オペラハウス　（サドラーズウェルズ系）,父系×母系Nijinsky 5*5×4，Northern Dancer 5×4*5父系内のみなし母系内のみなし,?,
*リタリエイション,2019年,イギリス,栗毛,2025年供用開始予定,?,Frankel　（ガリレオ系）,Honorina　（21-a）,Sea The Stars　（グリーンデザート系）,父系×母系Urban Sea 3×3，Danzig 4×5父系内のみNorthern Dancer 4*5母系内のみなし,?,
スマートファントム,2020年,日本,鹿毛,2025年供用開始予定,?,*ハービンジャー　（デインヒル系）,スマートアイリス　（1-w）,ディープインパクト　（ディープインパクト系）,父系×母系Northern Dancer 5*5×5，Lyphard 5×5父系内のみなし母系内のみなし,?,
ヴェルトライゼンデ,2017年,日本,黒鹿毛,2025年供用開始，2025年死亡,日経新春杯[G2]，鳴尾記念[G3],ドリームジャーニー　（ステイゴールド系）,*マンデラ　（3-d）,Acatenango　（ズルムー系）,父系×母系Northern Dancer 5×4父系内のみ*ノーザンテースト 5*4母系内のみなし,?,
フォルキャップ,2020年,日本,鹿毛,2025年供用開始予定,?,クレイドルサイアー　（ネイティヴダンサー系）,コスモフリップ　（1-k）,*アイルハヴアナザー　（ディストーティドヒューマー系）,父系×母系マルゼンスキー 4×5父系内のみなし母系内のみなし,?,
コスモジョイジョイ,2012年,日本,鹿毛,2025年供用開始予定,?,ジャングルポケット　（トニービン系）,*シルバージョイ　（13-c）,Silver Deputy　（デピュティミニスター系）,父系×母系Northern Dancer 4×5*4父系内のみなし母系内のみGold Digger 5*4,?,
